id_unique;objet;categorie
M2Y418J3BJ;services d'evaluation par des ergotherapeutes des demandes de prestation de compensation du handicap pch aides techniques et amenagement du logement  ;santé
FRN4ZFTVMK;rn406  desserte du port de bonneuil   production de l'evaluation economique et sociale relative a l'operation d'amenagement de la desserte du port de bonneuil sur marne par la rn406;social
9XVO0IVSC0;mission d'evaluation environnementale des sdage  pdm et pgri des bassins rhone mediterranee et de corse pour le compte de l'agence de l'eau rm&c a lyon;environnement
IJXV8JMHTE;prestations d'etudes en vue de l'evaluation environnementale de l'evolution des documents locaux d'urbanisme;environnement
AU1UJRSPHT;evaluation de l'action de gestion agricole sur les espaces naturels sensibles d'ille et vilaine et preconisations d'evolution;environnement
C2OQUO83J0;evaluation et suivi de la contribution sociale et economique de la filiere des macroalgues;social
QXUCV5IGFX;evaluation des impacts socio eco  sur la biodiversite  contribution du projet a la mise en oeuvre du cap et srb;environnement
6QA4MVXVQD;evaluer la politique departementale en matiere de preservation des milieux aquatiques  creer des outils de suivi  d'evaluation  de communication sur ce plan a bordeaux;environnement
OC0AIU3BDG;prestation de diagnostic et evaluation faune flore habitat du dept de l'isere a grenoble;logement
WJ7UBDJ8UQ;etude prospective et strategique no2018 18 intitulee : iran : evaluation du niveau de penetration du reseau pasdaran dans l'appareil etatique iranien et de son influence sur le processus decision;environnement
UWDEHSOW3Y;actualisation de l'evaluation environnementale strategique du cper 2021 2027 centre val de loire par l'integration du volet mobilite  lieu d'execution : region centre val de loire;environnement
J0Z48M0T0A;elaboration du plan local d'urbanisme intercommunal plui tenant lieu de plh soumis a evaluation environnementale;environnement
BASLPZ6YYY;evaluation et elaboration du plan departemental d'actions pour le logement et l'hebergement des personnes defavorisees;logement
P0C7AGZWA4;life riviere dordogne : evaluation des services economiques  sociologiques et ecosystemiques fournis par les milieux naturels de la riviere dordogne   etude a7;environnement
PI8EYI0VLX;elaboration d'un dossier de derogation a la stricte protection des especes et evaluation d'incidence natura 2000 en lien avec les abattages de platanes du canal du midi et ses annexes a toulouse;social
A04NY3HSGS;evaluation strategique des 'bourses du gouvernement francais' a paris;éducation-recherche
BFQUMKVX6H;evaluation coordonnee des cprdfp dans le domaine de la formation des demandeurs d'emploi pour le ministere charge du travail a paris;emploi-insertion
M7KXE3QYG8;94 prestations d' appui a l'evaluation et a l'optimisation des processus de codage de l'information medicale de l'ap hp ;santé
SAWJ3B770F;evaluation de la mise en oeuvre de la charte 2011 2026 du parc naturel regional de la haute vallee de chevreuse;environnement
NAHZTQ6IO2;etude d'evaluation de la couverture des reseaux mobiles a toulouse;environnement
POWK7OW5HL;evaluation du programme d'interet general amelioration et adaptation de l'habitat 2019 2023;logement
YBBRUH3DWD;mission d'assistance a maitrise d'ouvrage dans l'elaboration de l'evaluation environnementale du plan local d'urbanisme metropolitain de nantes metropole rectificatif;environnement
Y8EN0KFN4Q;evaluation du projet regional de sante   prs   de normandie;santé
ROGAIA06F2;evaluation du dispositif regional de soutien aux reseaux thematiques de recherche rtr;environnement
CIYNQE376N;marche public d'etudes relatives a la realisation d'une evaluation environnementale pour le plan local d'urbanisme intercommunal de la communaute de communes terrassonnais haut perigord;social
BVFYKVWKJD;evaluation du teletravail region auvergne;emploi-insertion
OVRBDWXTGU;mission de conseil et d'etude actions pour l'evaluation et la redefinition du projet culturel de territoire a ancenis;culture
3HSTQ85HZU;elaboration du plui tenant lieu de plui h avec evaluation environnementale;environnement
7UUQUSW219;evaluation du projet regional de sante de poitou charentes ars poitou charentes 4 rue micheline ostermeyer bp 20570 86021 poitiers cedex;santé
ZTEBUB0I80;appui a l'evaluation et a l'optimisation du codage et de l'information medicale des sejours en mco et des actes et consultations externes du chu a caen;santé
LNQWBEHQ0C;evaluation environnementale dans le cadre de la revision du plan de deplacements urbains de la communaute d'agglomeration du pays ajaccien a ajaccio;urbanité-transports
P3E8NBNW70;accompagnement a l'evaluation des organisations mises en place a l'occasion du projet nouveau chu a amiens;environnement
4TSDU7GRXG;evaluation esg des investissements;fiscalité-économie
TLHQWBZLHI;realisation de l'evaluation environnementale du projet d'amenagement forestier de la plaine de pierrelaye au profit du smapp a cergy pontoise;environnement
Y25WEDA63M;realisation de 3 lignes de bus a haut niveau de service bhns sur amiens metropole   inventaire et evaluation faunistique et floristique a amiens;environnement
BP5VFJYNAI;marche de services d'evaluation des operations de mediation hors les murs menees par le musee du louvre lens;culture
YER0X0FV5F;evaluation des aides a l'investissement et des aides de crise du fonds europeen pour les affaires maritimes et la peche;social
0XZHUF8A59;mission de conseil et d'etude actions pour l'evaluation et la redefinition du projet culturel de territoire a ancenis;culture
YJ9I0DIA0O;realisation d'une evaluation de l'aide fiscale a l'investissement dans le logement social outre mer pour le compte du ministere des outre mer a paris;social
K8WC157JHU;marche d'assistance et de conseil pour la realisation de l'etat initial de l'environnement et pour l'elaboration de l'evaluation environnementale dans le cadre de la revision;environnement
EV7V51ZETU;evaluation du dispositif d'intervention regionale lutte contre la desertification medicale   mesures incitatives en faveur des internes en medecine a metz;santé
XROP2KO355;evaluation des actions menees dans le cadre du  programme national d'actions contre le suicide 2011 2014  et une evaluation du  plan psychiatrie et sante mentale 2011 2015  :;santé
QM6QH4X517;23m0239pa evaluation de l'impact du changement de pratique et suivi des indicateurs environnementaux du projet life waste2build cm cp;environnement
Q3ODH5N0WJ;une evaluation des programmes d'education therapeutique du patient etp reconnus sur le plan legislatif par la loi hopital patients sante et territoires hpst du 21 juillet 2009 ;santé
317P30JXOV;numero de la consultation : 18106pi nouveau projet de renouvellement urbain de la communaute d'agglomeration roissy pays de france   prefiguration du dispositif de suivi evaluation du projet de r;social
8W6W34PI01;evaluation des dispositifs de developpement et de conventionnement dans le cadre de l'aide aux compagnies artistiques;social
DHYCR3G79Y;la presente consultation a pour objet l'evaluation du service experimental d'accompagnement a la vie professionnelle porte par l'association technique educatives  accompagnement et medi;emploi-insertion
A6XIIEO459;evaluation environnementale du plui h de la communaute de communes des monts de gy;social
5KMRCNND67;evaluation des dispositifs 'habitat existant' sur la ville de limoges de 2009 a 2014 et proposition de nouveaux outils d'amelioration de l'habitat  a limoges;logement
VKRCWZKJ4A;evaluation d'actions innovantes en sante et de projets e sante;santé
J391OBBKGN;evaluation environnementale du sage bas dauphine plaine de valence;environnement
RJ1MXPM90I;evaluation des politiques du departement des hauts de seine au regard des 17 objectifs de developpement durable et construction d'un agenda 2030;environnement
KLRR7TWO1O;realisation d'une evaluation portant sur le fonctionnement et l'organisation de deux batiments du nouvel hopital d'orleans batiment a et batiment b  a orleans;santé
JB8X9T5SAV;accompagnement individuel et evaluation des exploitants dans le cadre de l'experimentation des paiements pour services environnementaux financee par l'agence de l'eau rhone   medit;environnement
XGUNNMQ7KB;evaluation et preconisations prealables a la revision du schema departemental d'accueil et d'habitat des gens du voyage du puy de dome 2012 2018;logement
U9WUV38JUQ;evaluation environnementale strategique du plan climat air energie territorial;environnement
NJT4AG3SR3;evaluation de la mise en oeuvre du 6eme programme d'actions dans les zones vulnerables de la region bourgogne franche comte et l'evaluation environnementale du 7eme programme d'actions;environnement
FTRT5Z4G2T;accompagnement et appui du groupe de travail en charge de l'evaluation des plans nationaux sante environnement pnse pour la periode 2004 2019;santé
BKU0ID7EXG;evaluation multicritere permettant de mesurer les impacts de la politique d'insertion liee a l'activite economique ;emploi-insertion
X8HJVC2TCG;mission d'expertise faune flore et d'evaluation environnementale a sartene;environnement
TFQ24YTHIW;mission d'evaluation des trois projets de renovation urbaine et de formalisation d'un plan strategique local pour le compte du saes a sevran;logement
USHKIGXEQO;evaluation du dispositif d'aide aux tres petites entreprises mis en oeuvre par la communaute d'agglomeration de la porte du hainaut;fiscalité-économie
3YMAOQQ9B7;mission d'assistance a maitrise d'ouvrage pour l'evaluation environnementale concernant l'amenagement de l'ilot nord au mas de vignoles;environnement
EW7SPVT95G;realisation d'une etude d'evaluation du positionnement tarifaire de l'offre postale francaise en matiere de transport de la presse au regard d'autres pays europeens ;urbanité-transports
3PZ19DLYEO;devoiement rd 19   respect des servitudes aeronautiques de l'aeroport de bergerac   etat initial de l'environnement et pre evaluation des projets;environnement
RQI4675G4P;realisation de l'evaluation finale du premier programme local de l'habitat plh etelaboration du second plh de la communaute de d'agglomeration du pays de l'or;social
KQR07W6SQV;elaboration d'un cahier methodologique  referentiel d'evaluation pour la planification urbaine scot  plui  plh  plu qui sera partie integrante du dispositif aeu2 developpe par l'ademe a valbonne;urbanité-transports
UZJ14VFSCU;methodologie d'evaluation ex post du programme d'investissements d'avenir ' ville de demain ' pour le compte de la caisse des depots a paris;fiscalité-économie
DV12GTQW1B;assistance a maitrise d'ouvrage pour l'elaboration de la revision generale du schema d'amenagement regional sar de la reunion  de son evaluation environnementale  et de la concertatio;environnement
CIQ1WX0UB4;evaluation environnementale du schema de coherence territorial du pays de valencay en berry  de 16 plu et de 10 cartes communales du territoire;environnement
2N1BY9JX45;evaluation de mise en oeuvre et d'impact portant sur le dispositif de pret d'ordinateurs portables aux lyceens;éducation-recherche
69GHU51RJF;revision du pdu du grand reims en pdm a horizon 2032   elaboration du pdm et de son evaluation environnementale;environnement
FOB49MXUFP;evaluation du conseil consultatif de gouvernance alimentaire durable de bordeaux metropole et preconisations pour une evolution de son fonctionnement;environnement
KA3EDM2HGN;evaluation environnementale et accompagnement a la formalisation du projet de trame verte et bleue du plui;environnement
7Y4WQBBGCX;evaluation in itinere pack numerique lyceen;éducation-recherche
9RZTEIZXUS;evaluation nationale des projets educatifs territoriaux pour les ministeres de la sante  du travail et des sports a paris;santé
7LN5S3U4AM;amo pour l'actualisation de l'evaluation environnementale du schema regional d'amenagement  de developpement durable et d'egalite des territoires sraddet de la region provence al;environnement
WQH3Z98ZCL;evaluation approfondie du programme habiter mieux pour le compte de l'agence nationale de l'habitat a paris;logement
YVI8ELR5DJ;etude evaluation opah ru ori etude diagnostic de l'habitat prive ancien;logement
4H8VRCRH07;realisation de l'evaluation et du bilan diagnostic final du programme local de l'habitat 2016 2021 de la carene;logement
M8FO2S5J5U;evaluation d'impact du fse et de l'iej sur l'emploi et la formation programmation operationnelle 2014 2020;emploi-insertion
IHER2FQQZP;evaluation environnementale du plui de l'agglomeration cote basque adour  a bayonne;environnement
UV4VNVGB87;evaluation d'impact axe 4   la transition vers une economie a faible teneur en carbone du programme operationnel feder fse centre val de loire;fiscalité-économie
LGZZTLREL0;assistance a maitrise d'ouvrage pour l'animation  le suivi et l'evaluation des relogements dans le cadre des operations de renouvellement urbain engagees sur le territoire de la ville  a lyon;logement
E8AJPCPKKY;mission d'accompagnement a l'evaluation finale du contrat de ville 2115 2022;urbanité-transports
EM8Y0PS0ED;elaboration du plan local d'urbanisme intercommunal incluant l'evaluation environnementale pour le compte de valenciennes metropole;environnement
Y3HE09EVZN;evaluation environnementale et evaluation des incidences natura 2000 pour les procedures d'urbanisme des communes de nice cote d'azur;environnement
SL1HU970F0;evaluation de mise en oeuvre du fonds social europeen fse dans le cadre du programme operationnel feder fse de la region provence alpes cote d'azur a marseille;social
NVS7GCU3KE;assistance a maitrise d'ouvrage pour l'evaluation du contrat de ville ;urbanité-transports
0UNDXQTYGT;evaluation des programmes operationnels de l'habitat prive  avec redaction de preconisations et aide au deploiement pour la collectivite europeenne d'alsace cea;social
GAGBKBLQBW;amo pour l'evaluation a mi parcours du contrat de ville de clermont auvergne metropole;urbanité-transports
GTGE5WFLDV;etude de structure et evaluation de la capacite portante de 2 ouvrages de franchissement  permettant l'acces a la station de traitement des eaux usees de clarensac;environnement
VDZI8HYR46;21s013 evaluation de la politique d'intervention de l'agence de l'eau loire bretagne en faveur de la reduction des pollutions par les pesticides;environnement
FBD9YECF0B;evaluation environnementale du volet mobilites 2023 2027 du contrat de plan etat region 2021 2027 cper en bretagne;environnement
MU6CCVX6RT;rd6 amenagement de l'itineraire st pourcain vichy : evaluation environnementale   dossiers reglementaires;environnement
B790XCOHP5;realisation d'une analyse de faisabilite des conditions d'accompagnement identifiees par l'evaluation nationale de l'experimentation accompagnement a l'autonomie en sante;santé
MUJKF3FL5V;donnees necessaires au calcul des parites de pouvoir d'achat pour la construction par l'evaluation de devis detailles de constructions;urbanité-transports
4QM8FNCYRD;evaluation environnementale strategique du programme operationnel regional 2021 2027;environnement
BEH0QM268B;realisation du suivi animation et de l'evaluation d'une opah associee a un dispositif de soutien technique  animation de la plateforme de renovation energetique a auxerre ;logement
7JSBJ7G1QG;etude et accompagnement du departement de lot et garonne dans l optimisation du processus d evaluation des informations preoccupantes et de son articulation avec les professionnels des cms et les p  ;emploi-insertion
GUWHUPTFMZ;actualisation du diagnostic environnemental sur le nouveau perimetre du scot du grand rovaltain et evaluation environnementale des effets du scot depuis son approbation;environnement
T6UL9X5P6V;realisation d'une etude d'evaluation de l'impact economique  social et environnemental des championnats du monde de ski alpin   courchevel meribel 2023 pour le compte du ministere charg;social
RE33LK08TS;evaluation des missions relevant des missions d'interet general et d'aides a la contractualisation des etablissements de sante financees par l'ars de martinique au titre du fond d';santé
1UYBPJ1MJV;mission d'assistance a maitrise d'ouvrage pour l'evaluation du programme du construction du pole de loisirs et de services du center parcs de lot et garonne;urbanité-transports
EA28PG72P3;evaluation de la mise en oeuvre de l'accord cadre de partenariat pour l'insertion sociale et professionnelle des jeunes sous main de justice ;emploi-insertion
6DOHOF8HVC;marche elaboration du plan climat air energie territorial pcaet et realisation de l'evaluation environnementale strategique ees ;environnement
CWTTCBK57R;mission d'assistance a l'elaboration d'un plan climat air energie territorial pcaet et d'une evaluation environnementale strategique ees;environnement
5EF735UK9W;assistance a l'evaluation et l'elaboration du projet regional de sante de la martinique prs3;santé
YFGWRPCF9A;evaluation environnementale du schema regional des carrieres grand est;environnement
PEOC9OXEP3;evaluation des mesures agroenvironnementales et climatiques maec mises en oeuvre sur le territoire du pnr du haut jura;environnement
UH04H5J0XG;realisation de l'evaluation strategique environnementale du contrat de plan etat region bourgogne franche comte 2021 2027;environnement
KHHJYBZBR7;realisation de l'evaluation et du bilan diagnostic final du programme local de l'habitat 2016 2021 de la carene;logement
EDI9SC80TQ;realisation d'une evaluation environnementale ese prealable a la signature du cper pour la bretagne pour la periode 2021 2027;environnement
YOLDWT1F31;etude relative a l'evaluation environnementale des sage isle dronne et dordogne amont;environnement
N1NE175OE0;mission d'appui a l'elaboration du plan climat air energie territorial pcaet de la cceppg et de son evaluation environnementale strategique ees;environnement
BLITLXWVT5;la consultation a pour objet la passation d'un marche pour la realisation de l'evaluation strategique environnementale et la mise en place d'un dispositif de participation citoyenne dan;environnement
UYFLDPW1CR;marche d'assistance technique  financiere et administrative a la ville de paris dans le cadre du reseau eif fel evaluation information formation   francais en liens;social
MEYMIPS7VK;evaluation des operations programmees damelioration de lhabitat;logement
EHLRJWGC1F;marche pour l'elaboration du plan local d'urbanisme intercommunal plui de la touraine val de vienne   realisation du dossier complet du plui avec evaluation environnementale;environnement
22OV5VZH4A;affaire 23s0064 evaluation de la politique  jeunesse   comprenant 3 volets : dispositifs  logement    entreprenariat  et  mobilite   pour la periode 2018 2022;social
3WH1K5MZUA;evaluation de la mobilite des sediments lors des eclusees hydroelectriques sur des cours d'eau du bassin rhone mediterranee;environnement
BZPLAKAZN3;evaluation environnementale strategique du plan climat air energie territorial   relance apres declaration sans suite;environnement
ZLDNB6V3V9;mission de realisation d'une evaluation environnementale et de suivi sur le secteur antony pole a antony;environnement
98PXZDO5OZ;evaluation d'experimentations territoriales financees par le fpspp a destination des demandeurs d'emploi;emploi-insertion
68Z7IM3S5R;evaluation environnementale projet monet nord pour le chm;environnement
S08NVGNL9I;appui organisation formations et evaluation dispositif etp de la msa  formation des equipes educatives a l'etp et au programme d'education therapeutique des patients atteints de polypatholog;éducation-recherche
UJ6HD7ISSW;missions d'assistance a maitrise d'ouvrage amo pour elaboration du pcaet  accompagnement a une labellisation climat air energie  realisation de l'evaluation environnementale strategie du pcaet;environnement
RY7GNFRRQ4;realisation d'une mission d'evaluation de l'impact de l'aide au permis de conduire de la region boourgogne franche comte;social
DY5AVI03FO;prestations d'evaluation environnementale des dispositifs medicaux au profit du ght alliance de gironde;environnement
Y7LOWJRDYP;elaboration de l'evaluation environnementale du plui d de perpignan mediterranee metropole communaute urbaine;social
1NGBOQNFU0;creation d'un musee communautaire a sedan   evaluation et developpement du concept   etude de faisabilite et de definition  ;culture
5H5Y5STAQ9;realisation d'un plu intercommunal dont evaluation environnementale et etude agricole  fourniture du plui en version informatique reglementaire  au profit de la cc aubrac laguiole  a laguiole;environnement
LLNCYYUY9G;actualisations de l'evaluation environnementale du plui;environnement
SDCI35XR8X;elaboration du plan de prevention et de gestion des dechets issus des chantiers du batiments et des travaux publics du bassin economique lyonnais et de son evaluation environnementale a lyon;environnement
QZ13243NJL;evaluation des projets et candidatures scientifiques deposes dans le cadre des projets investissements d'avenir portes par l'universite de bordeaux;environnement
S1K8LN91NV;evaluation des voies reservees aux transports collectifs vrtc  vr2+;urbanité-transports
5NW4J947Z4;evaluation de la communication externe et interne du departement de la haute savoie  elaboration d'un nouveau plan de communication et accompagnement;environnement
5846QRVLJ7;evaluation environnementale du plu et d'un projet de parc d'activites sur le stade jules rimet commune de sussargues;environnement
LGKPDZBRCR;evaluation environnementale du scot de la cara;environnement
C5AK7MPDFS;evaluation environnementale et etudes ecologiques enjeux faune   flore   zone humide   longueil ii  ;environnement
K4J0IRQKF4;accompagnement pour l'evaluation des flux de gaz a effet de serre dans le cadre du programme life climat tourbieres du jura;environnement
D3LWFF60ZV;22s050 evaluation de la coherence globale du 11e programme de l'agence de l'eau loire bretagne et de son volet littoral;environnement
OA09O660XH;evaluation d'impact axe 5   la solidarite avec les quartiers urbains les plus defavorises;urbanité-transports
N3WJ1E1YMY;realisation d'une prestation d'evaluation du dispositif de l'aide financiere versee par la region bretagne aux stagiaires de dispositifs de formation professionnelle ;social
5DBBO1MJI1;assistance a maitrise d'ouvrage pour la realisation d'un dossier d'evaluation environnementale pour un projet de voie verte entre crancey et nogent sur seine  ;environnement
KW20CAZBAQ;mission d'assistance a l'animation  suivi et evaluation du plan climat air energie territorial pcaet de la carl;environnement
Q0P5TC3CAL;assistance a l'elaboration du pcaet commun et des deux pcaet specifiques a la capg et a la cacpl  realisation de leur evaluation environnementale et labellisation cit'ergie des pcaet specifiques;environnement
G1MUIZI09T;evaluation environnementale projet monet nord pour le chm;environnement
F4MKCA234Y;mission de conception d'un outil automatise et partage d'observation  d'evaluation et d'aide a la decision ;social
Z62B7PG1X9;prestations de services   prestations d'evaluation pour le recrutement pour la caf77 ;emploi-insertion
1UC3QKCJIY;appui a la realisation du programme d'evaluation de la politique regionale de formation professionnelle  d'apprentissage et de formation sanitaire et sociale;social
GJHPJG1E42;action d'evaluation prealable a un accompagnement a la creation d'entreprises epace en faveur des beneficiaires du revenu de solidarite active rsa;fiscalité-économie
ZNYDAB6TDC;accompagnement methodologique pour l'actualisation  mise en oeuvre  suivi et evaluation environnementale strategique du plan climat air energie territorial pcaet de la communaute urbaine dunker;environnement
1YMOZ01LC0;appui a l'animation  l'evaluation et la valorisation du reseau regional des acteurs de l'ecologie industrielle territoriale de provence alpes cote d'azur;environnement
E4B108QJNH;etudes  inventaires des milieux naturels  sur un cycle annuel prealables a evaluation environnementale   projet de reconnexion de la saane a la mer;environnement
UZVAR80KV5;suivi et evaluation du projet   nouveau programme national de renouvellement urbain d'ales ;environnement
K52M7O2O4Q;analyse et evaluation de l'organisation de la direction enfance education reussite educative;éducation-recherche
YSX4GIVH1Q;evaluation des politiques du departement des hauts de seine au regard des 17 objectifs de developpement durable et construction d'un agenda 2030;environnement
97A2MRKAZR;projet territorial de la basse vallee de la saanemarche d'evaluation environnementale;environnement
7DRHEC4QU5;evaluation d'impact axe 4   la transition vers une economie a faible teneur en carbone du programme operationnel feder fse centre val de loire;fiscalité-économie
EIDVL1K1OA;referentiel d'evaluation d'actions mises en oeuvre dans le cadre du plan economie resiliente sociale et solidaire du pacte vert;social
XADKCD9I9O;realisation d'etudes qualitatives  quantitatives  de conception d'intervention et d'evaluation d'impact aupres de differents publics dans le domaine de la sante  et suivi de terrai;santé
DL8DU5N1IV;accompagnement pour l'evaluation du schema departemental de la cohesion sociale et de l'insertion et a la mise en place du pacte territorial d'insertion et d'inclusion sociale;social
UUYPGG8UHX;recherche sur la sante mentale des detenus  prevalence des troubles mentaux  evaluation lors de l'incarceration et evolution au cours de la detention ;santé
CRR6AKFFQV;bilan  evaluation et revision du programme local de l'habitat sur le territoire de valenciennes metropole;logement
PC7EKCOI8E;enquete aupres de parents de jeunes enfants dans le cadre de l'evaluation de l'investissement social dans l'accueil du jeune enfant isaje;social
U2CVGJSAUM;etude prealable a l'epandage des boues de la station d'epuration de bourg en bresse et evaluation environnementale;environnement
WBY8ORXAKF;marches de services d'insertion professionnelle aupres des demandeurs d'emploi de la region grand est  evaluation par simulation prealable au recrutement  espr;emploi-insertion
