id_unique;objet;categorie
5GHIDI09X3;le marche a  en premier lieu  pour objet l'elaboration de l'evaluation environnementale strategique ees de la strategie nationale de mobilisation de la biomasse snmb ;environnement
ZNPN4YO10I;evaluation finale du fsp 2007 19 appui aux universites par extension de la carte universitaire  constitution d'ecoles doctorales et ouverture a l'entreprenariat au senegal   france etrange;éducation-recherche
B7YPQG49S3;evaluation du dispositif des plateformes territoriales de la renovation energetique soutenues par l'ademe ;logement
LDR0SS6HWU;projet centre de secours est actualisation de l'evaluation environnementale du plu;environnement
WAKOLQFMKX;evaluation du scot des agglomerations de lens lievin et henin carvin a henin beaumont cedex;environnement
4O93G67A72;assitance a maitrise d'ouvrage pour l'evaluation des actions  plan loire grandeur nature 2004 2008   programme bords de loire en roannais a roanne;environnement
IARB5Y46GR;marche de service realtif a l'evaluation et aux perspectives de trois demarches energie climat volontaires en champagne ardenne ;environnement
D3JDYHGSHI;mission d'assistance pour l'evaluation du dispositif d'animation territoriale de la communaute urbaine de lyon;social
ZDBUDR0X8Z;evaluation du programme colleges doctoraux franco pays partenaires a paris;éducation-recherche
DMCI7BMKUU;dispositif de reperage et d'evaluation de logements indignes locatifs sur le secteur sud ouest du tarn a albi;logement
1OI67NXOGK;realisation d'une evaluation retrospective d'une grappe de projets finances sur le fasep  iv en france et a l'etranger;fiscalité-économie
ENLBPNUURI;realisation d'etudes d'opinion et d'evaluation des actions de communication a bordeaux;environnement
7U1Z6U01WP;evaluation de la demarche zero pesticide  sur les territoires de la communaute urbaine a strasbourg;social
BEKOZ9MG27;conception  animation et evaluation de sequences pedagogiques du cycle de formation des responsables bop et uo organisees par l'igpde dans le cadre de son ecole de la lolf;éducation-recherche
UYSJPP18XO;operation urbaine fisac sur un quartier : mission d'evaluation a juan les pins;urbanité-transports
MFG4UM06WT;evaluation du programme national de recherche environnement sante travail pnrest pour l'anses a maisons alfort;santé
6P4GK7AJ35;evaluation environnementale du programme d'actions national relatif a l'application de la directive nitrates pour le ministere de l'ecologie a la defense;environnement
XS3TUFH3FH;assistance a maitrise d'ouvrage pour une evaluation quinquennale du plan de deplacements urbains de marseille provence metropole   eevaluation quinquennale et revision;urbanité-transports
K03JSANVC0;elaboration du plan local d'urbanisme intercommunal tenant lieu de programme local de l'habitat et comprenant une evaluation environnementale;environnement
ZJ9UPTI64E;le marche a pour objet des prestations de service d'evaluation des fonds de roulement des etablissements publics du reseau des cci de normandie hors concessions   delegations de service public ;environnement
7S2U7SMZQ1;evaluation du dispositif de relogement vallon des dervallieres   bout des landes bruyeres convention anru;logement
TXM6LBU32A;proposition methodologique pour la prise en compte de l'amenagement du territoire dans l'evaluation des projets d'infrastructures de transport a paris;urbanité-transports
VLNQXL83Z4;evaluation du dispositif d'aides aux particuliers pour l'installation de systemes de production d'energies renouvelables pour le conseil regional d'auvergne a chamalieres;social
19F9XA6UMP;definition  mise en oeuvre  suivi et evaluation des mesures compensatoires en faveur des zones humides et d'especes protegees pour le compte de la communaute de l'auxerrois a appoigny;social
GDES3D1641;evaluation quantitative et qualitative du dispositif emplois associatifs en midi pyrenees pour le compte du conseil regional  a toulouse;emploi-insertion
7KFJMSKO6T;evaluation environnementale du plan departemental de prevention et de gestion des dechets non dangereux de la loire;environnement
GXMKDT6ATX;evaluation du plan pour la reussite a l'ecole et une meilleure insertion scolaire premis  a nanterre;éducation-recherche
6RPRPATEAQ;bilan evaluation du schema d'organisation de la semaine scolaire de la ville de brest et des  temps d'activites periscolaires ;éducation-recherche
EL33RHXJUM;prestation d'evaluation de l'organisation et des ressources humaines necessaires a la direction de l'agriculture pour l'exercice de la fonction d'autorite de gestion du feader;environnement
IYYVKVZY3F;evaluation et conseil en conservation preventive pour un ensemble de photographies sur plaques de verre et supports souples appartenant aux collections du palais des ducs de lorraine   musee lorrain;culture
ZKZ1O4NVWP;94 evaluation de nouvelles versions de l'ajustement horaire des lames d'eau radar par les pluviometres pour meteo francea saint mande;environnement
AVDDFXVCHV;elaboration d'un plui avec evaluation environnementale et prise en compte de la loi alur et revision carte communal a saint claud;environnement
XH9ZIR4BVW;mission d'evaluation des aides aux tiers associatifs;social
0AWQGIZMXK;bilan   evaluation du contrat territorial 2007 2011   contrat territorial 2007 2011 pour la conservation de la qualite de l'eau sur le bassin versant de la touche poupard;environnement
EWIYFX7258;realisation d'enquetes mysteres dont le but est l'evaluation du reseau du recouvrement en matiere de relation telephonique et de reponses aux courriers electroniques  a montreuil;environnement
R8D0DHMM2G;prestation d'evaluation du contrat territorial   outil d'intervention de l'agence de l'eau loire bretagne a orleans;environnement
9FTGBOSGPW;appui a l'elaboration de la strategie du sage gravona  prunelli  golfes d'ajaccio et de lava et realisation de son evaluation environnementale a ajaccio;environnement
35M6A7D82W;mission d'elaboration du diagnostic territorial  realisation de l'evaluation environnementale pour la communaute urbaine le creusot montceau;environnement
ZB6O0C6N3S;mise en place d'un dispositif d'observation et d'evaluation du deuxieme programme local de l'habitat a ajaccio;logement
BR9404YHRW;fourniture d'une prestation de diagnostics territoriaux  d'accompagnement a l'organisation  a la mise en oeuvre et a l'evaluation d'activites de telemedecine en languedoc rous;santé
11V6BU471N;mission d'evaluation des dispositifs d'aides aux tiers publics du departement de la vienne a poitiers;social
N1WJKOBTCK;prestation de service pour l'evaluation du surcout lie a la prise en charge de personnes en situation de precarite dans les ehpad du cas vp  a paris;santé
TSRQ1T65FD;prestation d'ergotherapie dans le cadre de l'evaluation des besoins de compensation des personnes en situation de handicap a creteil cedex ;santé
O0TNJFZDCB;etat initial de l'environnement  volets agriculture foret et energie ges evaluation environnementale du scot des rives du rhone en revision;environnement
4NRVWH9ZKA;l'evaluation du fonds regional d'aide aux microprojets de developpement   framp a limoges;social
3PU37OJOJC;realisation d'une evaluation ex ante pour la programmation 2014 2020 du programme operationnel plurifonds feder et fse  et d'une evaluation strategique environnementale pour la prefecture de paris;environnement
T2P89L11O5;realisation d'une etude d'evaluation des pratiques des organismes de logement social en matiere d'impayes de loyer des menages locataires ;social
GMJXSPTZTF;support a la recherche clinique pour une etude portant sur l'evaluation de l'interet therapeutique de l'oxygenotherapie hyperbare dans les gelures graves  sallanches;santé
3B4BJVIDIS;mission d'assistance a maitrise d'ouvrage pour la conduite de l'evaluation environnementale des projets  plans et programmes poursuivis par la ville a drancy;environnement
XTXMWQI36I;evaluation des programmes europeens 2014 2020 en region des pays de la loire evaluations ex ante et evaluation strategique environnementale pour le conseil regional a nantes;environnement
913D6DAYM5;marche d'assistance technique regionale pour le pilotage  l'animation et l'evaluation dans le cadre du nouvel accompagnement a la creation ou reprise d'entreprise nacre region pa;fiscalité-économie
LG4ERQ37CX;analyse comparative et evaluation du cout moyen pondere du capital cmpc des gestionnaires de reseaux d'electricite et de gaz naturel en france pour la cre a paris;environnement
AKYPZVDT3V;evaluation du programme vieillir en bonne sante au profit de l' inpes a saint denis;santé
R7WR9CJQ8L;evaluation du programme de transformation ecologique et sociale regionale a lille;social
MJR56QUQFW;evaluation du cout du capital des filieres de production d'energie a partir de sources renouvelables en france ;fiscalité-économie
YW1VHBEURX;prestation concernant l'evaluation et la labellisation de la responsabilite societale de pas de calais habitat  a arras;logement
O91Y59SFVJ;etudes relatives a l'evaluation des contrats territoriaux 2010 2013 de bassins versants et a la realisation d'une synthese departementale ;emploi-insertion
G1I0WXWPP4;mission d'evaluation et d'assistance a maitrise d'ouvrage en vue du renouvellement de la convention de gestion et d'exploitation du service public de transports urbains pour le smtu a pau;urbanité-transports
UTCA7TV6EZ;evaluation environnementale du sage nappes profondes de gironde;environnement
742UFPJPNV;etat initial de l'environnement  volets agriculture foret et energie ges evaluation environnementale du scot des rives du rhone en revision;environnement
4JM3FQJZ9G;realisation de l'evaluation environnementale du pgri  du sdage et de son programme de mesure pm du bassin artois picardie;environnement
1869RJRVH8;mise en oeuvre de la mesure d'evaluation en situation de travail est pour un public beneficiaire du rsa  a la roche sur yon;emploi-insertion
VHG1K207FU;realisation d'une mission d'evaluation ex ante a la mise en place d'instruments financiers finances par les programmes operationnels 2014 2020 a fort de france cedex;fiscalité-économie
VHAWM0K02S;realisation d'une etude bilan  evaluation et perspectives du fonds regional d'amenagement foncier et urbain frafu de la martinique a fort de france;urbanité-transports
F4U289O1HQ;elaboration de l'evaluation environnementale du plan de prevention et de gestion des dechets non dangereux et du plan de prevention et de gestion des dechets a chalons en champagne;environnement
7QD64N2IKG;evaluation de la comprehension de l'etiquetage des produits de construction et de decoration sur leurs emissions en polluants volatils;urbanité-transports
BKVFC6BYUA;evaluation strategique des 'bourses du gouvernement francais' a paris;éducation-recherche
IKVVDRQZK8;mission d'etude et de conseil pour l'elaboration du plan local d'urbanisme avec evaluation environnementale et mise a jour de la zppaup au profit de la ville au touquet paris plage;environnement
B0G3GXH6OB;prestations d'evaluation sociale des familles faisant l'objet d'une procedure d'expulsion a epinay sur seine annulation;social
X2OMIY7BTJ;mission d'evaluation des actions municipales en direction des enfants et des adolescents pour les besoins de la commune de ris orangis 91130 a ris orangis;santé
MB9DBYWVII;evaluation environnementale dans le cadre de la revision du scot loire angers;environnement
Z7OKDGA72V;marche de prestations pour l'evaluation de 3 poles de developpement de l'economie sociale et solidaire en bretagne ;social
2R0AXQPZDZ;capitalisation 2016 des resultats des campagnes de suivi  evaluation des batiments laureats des appels a projet prebat  pour le compte de l'ademe  a angers;fiscalité-économie
167HIZ6NTR;evaluation du service d'aide a domicile compose d'un service prestataire et d'un servie mandataire ;social
USU3ZO1CZJ;realisation de l'evaluation environnementale du plan departemental de prevention et de gestion des dechets issus de chantiers du btp pdpgdbtp du var;environnement
ICLJSJLS6B;evaluation de la politique regionale  evaluation strategique environnementale du contrat de plan etat region 2015 2020 ;environnement
L1T3HPR7XK;appui a l'evaluation et a l'optimisation du codage de l'information medicale des sejours en mco et des actes et consultations externes du chu  a toulouse;santé
NXBXETT4JU;realisation d'etudes necessaires a l'elaboration du p l u : evaluation environnementale du plan local d'urbanisme de pont saint esprit  a pont saint esprit;environnement
HVKE44818R;a13 39 appui a l'elaboration de strategie du sage gravona  prunelli  golfes d'ajaccio et de lava et realisation de son evaluation environnementale a ajaccio;environnement
T6115H5BIY;evaluation des actions soutenues par le grand lyon et la region rhone alpes dans le cadre du plan de developpement 2008 2010 du pole de recherche et d'enseignement superieur pres universite de lyon;éducation-recherche
HFMU7W15BJ;evaluation a mi parcours relative aux modalites de mise en oeuvre du programme operationnel competitivite a amiens;fiscalité-économie
BF2JOAN1JY;evaluation medico economique du programme national d'intervention des infirmiers coordonnateurs dans le parcours personnalise de prise charge en cancerologie a boulogne billancourt;santé
L8LMVQCV3V;evaluation du contrat urbain de cohesion sociale 2010 2014 de thonon les bains  actualisation des besoins et prospective ;santé
9N3BELL4XZ;evaluation des interactions sur l'environnement des mesures prevues par les projets des schemas de structures de la manche  calvados  seine maritime  somme  pas de calais et du nord a gouville sur mer;environnement
DJKIQCMKRF;20 evaluation environnementale dans le cadre de la revision du plan de deplacements urbains de la communaute d'agglomeration du pays ajaccien a ajaccio;urbanité-transports
C56DBBMYUO;mission d'evaluation de la mise en oeuvre de la reforme des rythmes scolaires a saint herblain;éducation-recherche
DRBCL3O1Y2;mission d'assistance pour l'evaluation financiere des charges transferees dans le cadre de la transformation en metropole de la communaute d'agglomeration  a grenoble;social
F68IANFOXR;evaluation du projet de developpement et de renovation urbaine au profit de la ville a cayenne;logement
SMS09CWMN7;prestation pour la realisation de l'evaluation environnementale du schema regional de coherence ecologique de lorraine  au profit de la dreal lorraine a metz;environnement
TJLYKT7R9O;realisation de constats techniques portant sur des logements individuels ou collectifs et evaluation chiffree de travaux a fort de france;logement
KLULXBLEQ0;enquete et evaluation de l'impact financier pour la mise en place de la reforme tarifaire des transports regionaux au profit de la region a marseille;urbanité-transports
C0S64PV5UQ;evaluation de l'octroi de mer   volet finances locales pour les besoins du ministere charge de l'outre mer a paris;santé
89D8FMCMIW;confier a un prestataire l'evaluation de l'incitativite et de la selectivite du programme d'intervention de l'agence de l'eau adour garonne a toulouse;environnement
5CF38G82XP;evaluation ex ante et evaluation strategique environnementale du programme operationnel pluriregional loire 2014 2020 a orleans;environnement
1Z2ICPNEYM;developpement d'une methodologie d'evaluation ex post du programme investissements d'avenir opere par l'ademe a paris;fiscalité-économie
HYCSBADK9Q;evaluation a mi parcours du projet regional de sante rhone alpes  ainsi qu'une evaluation finale rendue au plus tard en juin 2017  a lyon;santé
B30RRGDWDA;mission d'analyse financiere pour les operations d'investissements et d'evaluation comparee des couts de financement;fiscalité-économie
6IR68Z6RAJ;evaluation medico economique du dispositif de suivi des nouveau nes vulnerables mis en oeuvre par les reseaux de perinatalites franciliens a paris;environnement
NCC37EB8ZT;mission d'evaluation de la gestion urbaine et sociale de proximite  bilan et accompagnement a l'elaboration de conventions;social
6AGPOS391Y;etude d'evaluation prospective des aides a l'animation;social
G63MW6Z4C0;marche de prestations d'evaluation sociale des familles faisant l'objet d'une procedure d'expulsion a epinay sur seine;social
G0PQQAFW97;etude technique  juridique et financiere pour la realisation d'une evaluation prealable a un contrat de partenariat sur le boulevard urbain sud;urbanité-transports
8BPWLLZD9I;execution de l'evaluation finale du projet du fonds de solidarite prioritaire fsp no 2009 22  soutien aux enseignements de francais en afghanistan sefa ii  paris;éducation-recherche
O18UIXEW4O;evaluation d'une operation programmee d'amelioration de l'habitat de droit commun 2008 2013 a le mayet de montagne;logement
MFC8G44AQY;evaluation du dispositif regional en matiere d'equipements de protection individuelle  de boites a outils et de tenues professionnelles  dans les lycees et cfa bas normands;éducation-recherche
S059PFD65L;mission d'evaluation des trois projets de renovation urbaine et de formalisation d'un plan strategique local pour le compte du saes a sevran;logement
045AZYSHX7;mission de bilan evaluatif du contrat urbain de cohesion sociale et du programme de renovation urbaine de limoges et accompagnement a la formalisation du plan strategiques local a limoges;social
W7SE0TEBRZ;elaboration de la revision generale du plan local d'urbanisme de la commune des avanchers valmorel   soumis a evaluation environnementale;environnement
N7QJJ2E6BW;evaluation environnementale dans le cadre du plu de blaye a blaye;environnement
L3K5EK11DO;evaluation du 4eme plan departemental d'action pour le logement des personnes defavorisees pdalpd et elaboration du 5eme pdalpd a toulouse cedex 09;logement
KF3AOK8H6U;etude technique  juridique et financiere pour la realisation d'une evaluation prealable a un contrat de partenariat sur le boulevard urbain sud rectificatif;urbanité-transports
8SV3KM3FFN;etude d'evaluation finale du projet anru de renovation urbaine du quartier de bras fusil a saint benoit a saint benoit;logement
D9XVU0SKPD;evaluation des fabriques a initiatives fai dans le cadre du plan regional de developpement de l'economie sociale et solidaire prdess;social
DZ2BVDDRBK;evaluation du cahier des charges regional de la permanence des soins ambulatoire en picardie;santé
IEWISFGYSF;mission d'etude et de conseil pour l'elaboration du plan local d'urbanisme de la ville de sangatte bleriot plage avec evaluation environnementale  a sangatte;environnement
ZXVNDJ9P07;evaluation des dispositifs habitat existant sur la ville de limoges de 2009 a 2014 et proposition de nouveaux outils d'amelioration de l'habitat  a limoges;logement
RZ6NZBY1DI;mission diagnostic faisabilite dans le cadre de l'evaluation des flux et programmation des besoins en stationnement;santé
97NU3VE9JP;mission d'etude socio economique d'evaluation de l'amenagement des terminaux de montoir pour gpm a nantes;urbanité-transports
U6ER082FCO;evaluation environnementale du scot du haut jura basee sur l'etat initial de l'environnement realise par les equipes du parc a lajoux;environnement
PEN3FJOPEG;marche de prefiguration et d'evaluation du dispositif perenne d'animation renovation energetique des coproprietes envisage par nantes metropole a nantes;logement
XGZQKZMQL9;evaluation reglementaire et juridique des pratiques d'investigations clinique :  ameliorer la mise en oeuvre des essais cliniques en france dans le cadre du nouveau contexte reglementaire europe;santé
VSEG4Q7BTE;reactualisation du diagnostic  des orientations  des fiches action et evaluation du programme local de l'habitat et mise en place des indicateurs d'un systeme d'observation de l'habitat a la rochelle;logement
5HSGQN05L8;mission d'evaluation economique et sociale du projet de deviation nord de nimes pour le conseil general du gard a nimes rectificatif;social
BRQUHQ1HLA;elaboration de la trame verte et bleue et realisation de l'evaluation environnementale du scot et du pdu en revision au profit de la cte d'agglo  a sophia antipolis;environnement
WEDOBR1SLL;evaluation strategique environnementale ese du contrat de plan etat region cper de haute normandie pour le compte du sgar   mission achats de rouen;environnement
879251TADC;evaluation des aptameres comme substituts aux anticorps pour la quantification de biomarqueurs tissulaires en anatomopathologie clinique pour le compte de l'inserm a bordeaux;santé
I0SP71DS00;conventionnement du reseau d'expertise  pour l'evaluation de projets de creation d'entreprise  a maisons alfort;fiscalité-économie
HU1PUDXKPD;assistance a la maison departementale des personnes handicapees du finistere mdph dans le cadre de ses missions d'evaluation des besoins de compensation du handicap;santé
08FUVVA4R8;evaluation des impacts de la politique publique environnementale agricole et realisation d'un diagnostic climagri sur le territoire ternois 7 vallees;environnement
QQP5Y9Y5Z9;evaluation ex ante et evaluation strategique environnementale des programmes operationnels 2014 2020 au profit de la region a orleans;environnement
BBEBQX75YW;prestations d'evaluation coordonnee des cprdfp dans le domaine de la formation des demandeurs d'emploi pour le compte du ministere charge du travail a paris;emploi-insertion
160I5EYK51;marche d'assistance et de conseil pour la realisation de l'etat initial de l'environnement et pour l'elaboration de l'evaluation environnementale dans le cadre de la revision;environnement
OCZSZ7BMG1;assistance a maitrise d'ouvrage   evaluation   action   etude de prefiguration des projets de sante de zone de proximite  marche a procedure adaptee ouverte soumis aux dispositions de l'arti;santé
92QNFJN40K;evaluation du dispositif d'aide dechets de l'ademe sur 2009 2010 pour ademe a angers;social
PH8RO9LOSL;elaboration du plan de prevention et de gestion des dechets dangereux de mayotte incluant son evaluation environnementale ;environnement
SLTBHKM6NM;evaluation finale du projet du fsp 2006 58 :  projet d'appui a la structuration et a la creation des formations technologiques dans l'enseignement superieur public en angola angosup ;éducation-recherche
PT9IYDJJN1;accompagnement a la grenellisation et realisation de l'etat initial de l'environnement et de l'evaluation environnementale ex ante du plan local d'urbanisme a le port;environnement
GGMZHH38QF;etude relative a l'evaluation du differentiel de competitivite entre les industries graphiques francaises et leurs concurrents europeens;fiscalité-économie
109VJA5CUG;evaluation du contrat urbain de cohesion sociale de la ville de gap pour la periode 2009 2014;social
5PGSTUJV3W;prestation d'evaluation du plan departemental d'action logement des personnes defavorisees a rouen;logement
JQYA2KZ09X;evaluation finale du projet  justice et securite en zone sahelo saharienne   jussec fsp 2009 17  france;justice-défense
TXUT91NP77;evaluation de l'interet ecologique d'un plan d'eau sur le site natura 2000 :  saint beauzire  fr 8301083 ;environnement
UX1Z8VHGM4;missions d'accompagnement de suivi et d'evaluation du contrat de ville de la porte du hainaut pour la periode 2015 2020;urbanité-transports
H2FSGJEPEY;elaboration du p l u  tranche ferme : conduite de la procedure et constitution du dossier tranche conditionnelle : evaluation environnementale;environnement
WZ57ATKE1V;evaluation de six reseaux de sante a gourbeyre;santé
UXIX2JAMJ8;evaluation a caractere retrospectif et prospectif portant sur le programme regional de developpement agricole et rural prdar porte par la chambre regionale d'agriculture cra du centre ;environnement
98ILYHGREW;le present marche a pour objet l'evaluation de la permanence des soins en kinesitherapie respiratoire  a travers les associations lexobronchio et sos kine cuc;santé
S57NINWFYK;marche m009 14 l'evaluation environnementale du sdage 2016 2021 de la martinique a fort de france;environnement
9EDV9H4D7Z;evaluation environnementale pour le plan local d'urabnisme de la commune de villeneuve le roi;environnement
HCV1339ZRJ;prestation pour la realisation d'une etude d'evaluation des effets potentiels sur les milieux naturels de chaque projet d'amenagement d'infrastuctrures routieres a saint etienne;environnement
WU57V72E92;evaluation de l'instrument pret du tresor dans le domaine de l'eau et de l'assainissement depuis 2008 ;environnement
OQZOWE6SYY;evaluation environnementale du projet de schema d'amenagement de la plage de pampelone;environnement
M5FB73TV1B;evaluation de la colocation et de l'habitat regroupe a destination des personnes en situation de handicap et preconisations suite a cette evaluation a st brieuc cedex 1;santé
K0ZFX5ZGOO;evaluation environnementale du plan de deplacements urbains pdude troyes champagne metropole;urbanité-transports
61KLYFMX1O;realisation de l'evaluation environnementale du scot;environnement
8AR2I714NG;evaluation du programme regional de renovation energetique des batiments : effilogis;logement
71GW09HFKY;prestations d'evaluation sociale des familles faisant l'objet d'une procedure d'expulsion a epinay sur seine;social
KBD06DIALB;elaboration de l'evaluation ex ante  de l'evaluation strategique environnementale et du systeme d'indicateurs du futur programme cte med 2014 2020 au profit de la region a marseille;environnement
M9QWL7T99E;actualisation du diagnostic  evaluation des actions et revision du plan departemental d'accueil  d'hebergement et d'insertion des personnes sans domicile et mal logees pdahi de la gironde;emploi-insertion
KODA152XWZ;evaluation ex ante et evaluation strategique environnementale des programmes regionaux feder fse et feader 2014 2020 au profit du conseil regional d'aquitaine  a bordeaux;environnement
03T2ZNW2CB;mission d'assistance a l'evaluation des apprentissages sportifs et des parcours culturels;culture
Y70F9MS0Q5;evaluation environnementale et redaction des rapports environnementaux et des declarations prevues a l'article l  122 10 du code de l'environnement pour le compte de l'agence de l'eau  a toulouse;environnement
