id_unique;objet;categorie
RWPAMPR19G;mission d'assistance a maitrise d'ouvrage pour l'evaluation du contrat urbain de cohesion sociale cucs 2007 2014 et l'elaboration du contrat de ville pour la periode 2015 2020;social
LKQWFVR28E;evaluation des dispositifs habitat existant sur la ville de limoges de 2009 a 2014 et proposition de nouveaux outils d'amelioration de l'habitat;logement
SOCTZCTF4A;evaluation de la politique menee en 10 ans par la region midi pyrenees en matiere de formations sanitaires et sociales depuis le transfert de competences d'aout 2004 a toulouse;social
KV2D56Y993;l'objectif de la presente etude sera de relever et d'evaluer les problemes decoulant de la mise en oeuvre du reglement clp ainsi que l'interaction entre differents textes legislatifs sur les produits chimiques hors reach et les dispositions re   ;éducation-recherche
CJO1PA0W7X;evaluation du plan pour les continuites professionnelles 2012 2015;emploi-insertion
350HTN6UZN;prestation d'evaluation d'une thematique du prs bourgogne: scolarisation en milieu ordinaire des enfants handicapes;santé
I96YMQ31HZ;evaluation de la politique regionale des lieux d'accueil en vue de la creation d'entreprises innovantes;fiscalité-économie
73B5CY272M;evaluation de la politique de l'habitat sur le parc prive et l'elaboration d'un plan d'actions;logement
HZC8T4Q6D9;evaluation de l'effort des lycees aquitains en matiere d'achat de produits biologiques et d'approvisionnements par circuit court dans le cadre de la restauration scolaire;éducation-recherche
579JLBWC8F;evaluation du defi aquitaine climat;environnement
777WG1CL1Z;evaluation medico economique du dispositif de suivi des nouveau  nes vulnerables mis en oeuvre par les reseaux de perinatalites franciliens ;environnement
Z0JVM734HQ;final external evaluation of the capacity development for education for all capefa programme;éducation-recherche
3XCZH09PZR;evaluation prospective de lopah engage par la communaute de communes varennes forterre;social
H3NOEIO06O;analyses chimiques et microbiologiques pour l'evaluation de l'impact environnemental et sanitaire d'une station d'epuration sur la qualite des eaux a la roche sur yon;environnement
EWO8TVFTBC;evaluation ex ante et evaluation environnementale strategique du programme operationnel de cooperation territoriale saint martin sint marteen 2014 2020;environnement
P4FL2YD6LG;l'elaboration du diagnostic a 360 ° et evaluation du plan departemental d'action pour le logement des personnes defavorisees 2011 2014 et elaboration et redaction du plan departemental d'action pour le logement et l'hebergement des personnes def   ;logement
BXRU5SIS4Z;mission d'etude et d'animation pour l'elaboration du 2e programme local de l'habitat de la communaute d'agglomeration accm pour la periode 2016 2021  la mission d'etude integrera l'evaluation du 1er plh pour la periode 2008 2014 ;social
4BYAXJ2QMH;evaluation des mesures mises en oeuvre pour l'agriculture en faveur des regions ultraperipheriques posei et des petites iles de la mer egee  dans le cadre de la politique agricole commune ;environnement
NBINBA1WW0;etude prealable milieux aquatiques  bilan evaluation ctma 2009 2013  definition d'un nouveau programme sur le bassin versant du linon;environnement
B8ZD0JBSAE;evaluation des actions conduites par la region aquitaine en faveur de la jeunesse;social
53N24DX9B6;preparation du contrat de ville 2015   2020 mission d'assistance relative a la creation d'un dispositif de suivi evaluation et aux aspects organisationnels gouvernance et mise en oeuvre;urbanité-transports
JADMB24295;etude d'evaluation de l'impact de l'assainissement du sivom du bassin de l'ehn sur le milieu naturel  a obernai;environnement
N0NYQZBO97;evaluation du fonctionnement et de la coordination des 16 reseaux precarite sante mentale pour l'ars nord pas de calais ;santé
R4LYO1W36Q;bilan evaluatif du programme <<l'aquitaine cultive la biodiversite>>;environnement
AJ6KYYLSYS;mission d'evaluation du programme de renovation urbaine du nouveau mons;environnement
583C6PFYVC;evaluation du programme d'aide a la creation d'entreprises innovantes en mediterranee paceim;fiscalité-économie
VOHQJ401SE;evaluation des politiques publiques developpees au niveau local    ;environnement
B9XNXPEAQR;evaluation et valorisation des actions de la mission continuite professionnelle au titre de la politique du fonds d'intervention regionale pour l'investissement social  iris;social
S0K738XSKZ;le present marche a pour objet une mission d'evaluation a mi parcours et de modification du programme local de l'habitat de nevers agglomeration  le present marche a pour objet une prestation de service visant a : phase 1 : evaluer a mi parcour   ;logement
M2HJJIDSA1;a14 33 mise en place d'un dispositif d'observation et d'evaluation du deuxieme programme local de l'habitat ;logement
M3V2VCW8OH;evaluation finale de l'activite du programme leader 2007 2013 du gal sud corse : un territoire innovant et durable ;environnement
8SLK30KGBY;mission de prestation de service pour la realisation de l'evaluation strategique environnementale ducontrat de plan etat region 2015 2020 en aquitaine;environnement
CVFLQ66GZM;evaluation du pdalpd et du pdahi 2009 2014 du departement des deux sevres et accompagnement a l'elaboration du nouveau plan pdalhpd;environnement
GEH203LD4X;evaluation des activites d'instruction de projets finances sur part bilaterale francaise au fonds multilaterale du protocole de montreal et du role du savoir faire industriel francais dans le secteur de l'ozone;fiscalité-économie
XENV4X7HK5;mission d'assistance a maitrise d'ouvrage pour evaluer le dispositif de la reforme du service public de la restauration scolaire ;éducation-recherche
B6XTC2H3I5;la presente consultation a pour objet de conclure un accord cadre regissant les marches subsequents a passer au cours de la periode de validite de cet accord  l'objet de cet accord cadre et des marches subsequents qui seront conclus sur son fondement est la realisation d'etudes visant a l'evaluation de politiques publiques  pour le compte du comite d'evaluation et de controle des politiques publiques de l assemblee nationale  organe de cette assemblee qui met en oeuvre la mission d'evaluation des politiques publiques devolue au parlement par l'article 24 de la constitution  le cahier des clauses particulieres ccp de l'accord cadre  et notamment ses articles 6 et 7  precisent la nature des travaux et les competences potentiellement attendues  pour rassembler les differentes techniques et competences sectorielles recherchees selon les marches subsequents  les candidats pourront etre amenes a presenter des equipes pluridisciplinaires si les candidats veulent se presenter en groupement ou avec des sous traitants  se reporter aux dispositions du reglement de la consultation et a l'article 10 du ccp  l'accord cadre est attribue a huit titulaires  sous reserve d'un nombre suffisant de candidats et d'offres  l'accord cadre est conclu pour un an a compter du 16 fevrier 2015 ou de sa notification si celle ci intervient ulterieurement ;emploi-insertion
RCWRL5Q8NU;etude evaluation de la politique de l'habitat;logement
RE8RRMA2TE;prise en compte de la qualite de l'air dans les outils d'evaluation des projets d'urbanisme;urbanité-transports
CR13VV4SFR;belgique bruxelles: evaluation ex post des programmes de la politique de cohesion 2007 2013  axee sur le fonds europeen de developpement regional feder et le fonds de cohesion fc ? volet 6: environnement;social
0A1RB4YUTL;evaluation de l'appel a projets prevention et lutte contre les discriminations dans la formation professionnelle et l'apprentissage en aquitaine de 2008 a 2013;emploi-insertion
OPEYKZ3TWL;aeu2   referentiel d'evaluation pour les operations d'amenagement;urbanité-transports
2GQLGFDLEF;definir une strategie d'adaptation aux changements climatiques : du diagnostic de vulnerabilite a l'elaboration du plan d'action et de son systeme de suivi evaluation;environnement
6FGNR89GVS;evaluation externe du service de soins infirmiers a domicile du centre communal d'action sociale de la ville de laon ;santé
DNLI08CIPG;evaluation du programme d'interet general habitat indigne et precarite energetique;logement
ZZE3IRZRUZ;evaluation du plan maladies rares 2011 2014;santé
CZ1IIQVTYJ;prestation de suivi et evaluation du programme operationnel nation  emploi et inclusion  du fse pour la periode 2014 2020 a paris;emploi-insertion
535VQ9EJYY;belgique bruxelles: evaluation ex post des programmes de la politique de cohesion 2007 2013  axes sur le fonds europeen de developpement regional feder et le fonds de cohesion fc ? volet 5: transport;social
TSPEKX3N6O;belgique bruxelles: evaluation ex post des programmes de la politique de cohesion 2007 2013  axes sur le fonds europeen de developpement regional feder et le fonds de cohesion fc ? volet 6: environnement;social
Q43EGKLTDD;le marche porte sur une evaluation du contrat de plan regional de la formation professionnelle de la reunion cprdfp;emploi-insertion
JN24D50KZT;mise en oeuvre du dispositif d'evaluation continue de la qualite produite par les professionnels du tourisme d'ile de france ;emploi-insertion
JNEJMJNB1Q;realisation de l'evaluation de l'apport de l'accompagnement par la federation nationale d'education et de promotion de la san   ;éducation-recherche
RLAM6NZOOU;evaluation strategique environnementale du contrat de plan etat   region 2015 2020 pour la region poitou charentes;environnement
YBW5LDALO1;prestation d'accompagnement a la mise en oeuvre d'une plateforme d'evaluation dans le cadre de l'action sociale ;social
NI3D1W672T;realisation de 2 journees de formation par departement soit 8 journees associations  comment mieux valoriser son projet : quels indicateurs  l'objectif est d'informer sur les methodologies d'evaluation de l'utilite sociale des asso   ;social
0PXEJ82QNS;evaluation du pdalpd de la vendee 2010 2014 et assistance a l'elaboration du nouveau pdalhpd;environnement
IP5439KS9L;evaluation et deploiement de la politique d'accueil en beaujolais vert;environnement
UV5RY5TOG6;evaluation strategique environnementale du contrat de plan etat region bretagne 2015 2020  ce marche fait partie du dispositif marche public simplifie mps;environnement
6G7CWQ6KDU;etude d'evaluation prospective du dispositif contrat territoire culture en midi pyrenees;culture
GLTS3UQRJO;evaluation de l'accompagnement des plans climat energie territoriaux par l'ademe;environnement
2KZNAUCMZH;conception d'un tableau de bord pour l'evaluation du plan de renovation energetique de l'habitat en lorraine;logement
M4GNGTTVZY;conception d'un tableau de bord pour l'evaluation in itinere du plan de renovation energetique de l'habitat preh en lorraine;logement
QCMFRKU0DV;prestations d'accompagnement pour l'evaluation des politiques publiques conduites dans le domaine de l'eau visant a reaffirmer les enjeux territoriaux lies a l'eau  apprecier les roles et les missions du departement ainsi que l'implication des a   ;environnement
66NIUP53D6;evaluation prospective de l'operation programmee d'amelioration de l'habitat opah de droit commun du val de cher;logement
FXH22RSL5F;evaluation retrospective liban nord et sud   eau et assainissement;environnement
5AUFC3INLL;marche d'assistance a maitrise d'ouvrage pour le controle et l'evaluation du service de transport de personnes a mobilite reduite  pam92  ;urbanité-transports
JAAHED7UOL;evaluation du dispositif d'aide aux organismes logeant a titre temporaire des personnes defavorisees alt1;social
DS799Q2LJO;evaluation et mise en oeuvre d'un dispositif de coordination de l'ensemble des services d'intervention au domicile en faveur des personnes handicapees;santé
9W6HOSJSMT;evaluation externe des differents poles du cias du marsan;emploi-insertion
U4YD0G65OT;  prestation d'accompagnement prealable a la mise en place de la demarche d'evaluation du projet regional de sante de bretagne 2012 2016 ;santé
RBDJWYN72I;evaluation du contrat de progres pour les metiers d'art et du contrat de progres pour l'economie du livre ;fiscalité-économie
36VZC1U4OB;mission d'evaluation de la politique de developpement durable du departement de la somme et d'appui strategique et operationnel dans la perspective de l'elaboration de l'acte ii de l'agenda 21 ;environnement
4W1YZ178U7;mission d'evaluation des trois projets de renovation urbaine de sevran et de formalisation d'un plan strategique local ;logement
BOINFRFCOC;l'objectif general de l'etude est de definir l'utilisation <<en cascade>> du bois et d'en evaluer les incidences environnementales et socio economiques  d'analyser les obstacles a l'utilisation <<en cascade>> du bois ainsi que les eventuelles mesure   ;environnement
061EJ40EOQ;les objectifs du present marche lance par la dg commerce consistent a evaluer le reglement sur 4 points conformement aux normes d'evaluation de la commission: 1  efficacite: dans quelle mesure le reglement a t il atteint ses objectifs' 2  efficience: les frais engages sont ils justifies compte tenu des resultats' ce point comprend notamment une evaluation de la charge administrative pour les entreprises  en particulier les pme  3  coherence: dans quelle mesure le reglement est il coherent en interne  par rapport aux autres politiques de l'ue  aux objectifs des traites et aux activites des autres acteurs' 4  pertinence: dans quelle mesure les objectifs initiaux correspondent ils toujours aux besoins de l'ue' quel est le role d'un reglement';fiscalité-économie
8LY7C04G99;prestations de services pour des evaluations et ou expertises sur des thematiques liees a la jeunesse  aux politiques de jeunesse ou a l'education populaire;social
S1QMF4WHPZ;synthese des resultats des evaluations ex ante realisees au niveau national ou regional et relatives aux programmes de developpement rural couvrant la periode de programmation 2014'2020 ;environnement
Y5SHC4K18E;evaluation des fabriques a initiatives fai dans le cadre du plan regional de developpement de l'economie sociale et solidaire prdess ;social
2ST5E5A87K;evaluation du plan regional sante environnement prse2 de poitou charentes;santé
Q2IMBIGJST;fourniture d'un questionnaire accessible par internet portant sur l'auto evaluation de la sante des mineurs sous protection j   ;santé
87D1XUNOF1;fourniture d'un questionnaire accessible par internet portant sur l'auto evaluation de la sante des mineurs sous protection judiciaire en lien avec les prises de risque concernant les produits psycho actifs consommation et trafic;santé
NDJDV0NS95;realisation des dossiers d'autorisations reglementaires prealables au projet haut des pres : autorisation de loi sur l'eau  evaluation des incidences natura 2000 et etude d'impact  a brie comte robert;environnement
LOZ78O7G9D;le marche evaluera les types d'interventions et les premiers indices de l'effectivite des investissements dans l'efficacite energetique des batiments publics et residentiels  ainsi que la motivation de ces investissements ;fiscalité-économie
TFNEAS84LE;assistance a maitrise d'ouvrage pour l'evaluation strategique du programme local de l'habitat 2012 2017;logement
ZWS1NO92CQ;evaluation de la permanence des soins en kinesitherapie respiratoire  via les associations lexobronchio et sos kine cuc;santé
8YCGUZB1Q4;evaluation du dispositif experimental de la permanence des soins ambulatoires pdsa en pays de la loire ;santé
C3BS6TCKTT;etude pour une evaluation strategique environnementaleese des contrats de plan et contrat de projets interregional loire 2014 2020;environnement
U6GCHUVB39;mission d'evaluation des contrats territorialises de developpement durable du departement de meurthe et moselle;environnement
4112BPZMHB;evaluation des conseils locaux de sante mentale clsm soutenus par l'agence regionale de sante d'ile de france ;santé
8VBZ36H5G5;evaluation globale de la gouvernance du plan regional sante environnement 2011 2014 prse2 en nord pas de calais ;santé
2K2RDNJE6A;evaluation globale de la gouvernance du plan regional sante environnement 2011 2014 en nord pas de calais;santé
ZTYAN1MW86;evaluation et structuration de la politique departementale de l'eau pour le compte du conseil general a saint etienne;environnement
ZEBZ4VULYM;appel a proposition relatif a l'evaluation du plan local pour l'insertion et l'emploi de cap nord martinique et propositions de mise en oeuvre du nouveau plie ;emploi-insertion
F7KR1FXBCG;belgique bruxelles: evaluation ex post des programmes de la politique de cohesion 2007 2013 finances par le fonds europeen de developpement regional feder et le fonds de cohesion fc ? volet 10: developpement urbain et infrastructures sociales;social
EWUBLQX58P;evaluation du projet regional de sante prs de l'agence regionale de sante de provence alpes cote d'azur;santé
ZC310OGPYU;le marche definira la nature et les objectifs des investissements cofinances dans les domaines du developpement urbain et des infrastructures sociales  et evaluera si et dans quelle mesure ils ont ete mis en oeuvre par le biais de strategies integrees ;fiscalité-économie
1PI4OI3QAM;evaluation extra financiere et cotation des pratiques et des politiques de developpement durable et etablissement d'un referentiel specifique au groupe brl;environnement
RYJ65I2RQY;evaluation environnementale du scot de l'agglo orleans val de loire   relance d'une consultation declaree sans suite pour motif d'interet general;environnement
U4W0ZNP5NY;prestations de services pour des evaluations et ou expertises sur des thematiques liees a la jeunesse  aux politiques de jeunesse  ou a l'education populaire a paris;social
7H5CA2T8FS;evaluation du plan d'equipement informatique et des usages numeriques des colleges;éducation-recherche
BHY82H0L2D;evaluation des effets produits et des impacts sur l'ensemble des acteurs du projet de reussite educative   il s'agit de realiser un travail d'evaluation cible sur l'identification rectificatif;emploi-insertion
1AYWZ9REQW;evaluation du dispositif du subventionnement des politiques section v et evaluation des dispositifs subventionnes dans le cadre de la politiques d'aides aux aidants;social
LSHQL49TP9;evaluation ex ante des instruments financiers finances par le programme operationnel feder fse 2014 2020;fiscalité-économie
1N8W5JZ8AR;realisation d'enquetes mysteres dont le but est l'evaluation du reseau du recouvrement en matiere de relation telephonique et de reponses aux courriers electroniques ;environnement
DJW6S0VB4Z;appui aux missions d'evaluation environnementale de la dreal poitou charentes;environnement
5VVDB9W0D0;evaluation du plan climat energie territorial du conseil genaral des alpes de haute provence;environnement
AKK253BEY1;evaluation environnementale dans le cadre de la revision generale du plan local d'urbanisme de doullens;environnement
66P0IG9GFO;evaluation finale du projet << appui aux financements innovants de la conservation de la biodiversite du reseau redlac >> et etude de faisabilite d'un nouveau projet  ;environnement
04Q14AG80Z;evaluation du dispositif d'aide aux tres petites entreprises mis en oeuvre par la communaute d'agglomeration de la porte du hainaut depuis 2009;fiscalité-économie
VZFG86HHTD;evaluation environnementale   projet de plu;environnement
11B8NO9S2Q;evaluation et nouveaux enjeux de la politique regionale en faveur des scenes de musiques actuelles smac;environnement
5Y7H2Z6YRN;evaluation des projets de renovation urbaine d'anzin et du corridor minier pour le compte de valenciennes metropole;logement
FN93WWZEKV;evaluation economique du programme experimental d'accompagnement des victimes d'accidents du travail graves 2014 2016 aux fins de generalisation;emploi-insertion
A2EU7PVCDF;mission d'evaluation de l'impact du teletravail & des tiers lieux sur la reduction des consommations d'energie et des missions de gaz a effet de serre et sur l'organisation des entreprises ;fiscalité-économie
G29TB0MGQT;bilan evaluatif et prospectif des programmes regionaux d amenagement durable et solidaire prads  politique montagne  en provence alpes cote dazur  2007 2013;social
OG4D19BE97;la presente consultation a pour objet la realisation d'une etude sur l'evaluation des effets de l'education artistique et culturelle selon une analyse methodologique et epistemologique;culture
32JW8M0GFN;etude sur l'evaluation de la politique departementale relative a la preservation de la biodiversite ;environnement
824A2TBGLY;realisation d'une mission d'evaluation ex ante a la mise en place d'instruments financiers finances par les programmes regionaux 2014 2020 feder  fse  feader et le volet regional feamp a mayotte;fiscalité-économie
EAFEFGQWWB;evaluation de la politique regionale  evaluation strategique environnementale du contrat de plan etat region 2015 2020;environnement
AWWDLT9ACY;elaboration de la strategie environnementale et de l'evaluation environnementale du plan local d'urbanisme intercommunal de la communaute urbaine d'arras ;environnement
SI4AIFX44A;la presente consultation a pour objet de confier un marche public a un prestataire en vue de la realisation d'une etude portant sur l'evaluation de la politique de communication pedagogique de l'agence de l'eau adour garonne;environnement
IMWFQ33L49;mission de suivi  animation  assistance et evaluation d'une operation programmee d'amelioration de l'habitat;logement
XKBZCAG5BM;enquete de suivi des jeunes passes dans une structure d'accompagnement social evaluation de la garantie jeunes a paris;social
NSQTLF6SUJ;rectificatif de l'annonce : l'objectif de la presente l'etude est d'evaluer et d'optimiser la strategie climatique regionale en faveur des lycees et des bases de loisirs bpal  dans l'optique de l'atteinte des objectifs climatiques regionaux  a   ;environnement
XNV1RZ3Z23;evaluation de la politique regionale  evaluation strategique environnementale du contrat de plan etat region 2015 2020  rectificatif;environnement
OT0PY3F0NJ;evaluation du dispositif de mobilisation des professionnels du batiment via le reseau beep;environnement
OVY3XAII5Y;evaluation du plan d'actions tourisme durable 2009 2013 et definition d'un nouveau plan d'actions pour la periode 2014 2018;environnement
1LBJSJ8RF9;evaluation environnementale strategique ees du contrat de plan etat region cper auvergne pour 2014 2020;environnement
2PDJ4AR9A9;evaluation des dispositifs d'annonce d'une maladie chronique;santé
GCHX2REYCQ;l'objectif de la presente l'etude est d'evaluer et d'optimiser la strategie climatique regionale en faveur des lycees et des bases de loisirs bpal  dans l'optique de l'atteinte des objectifs climatiques regionaux  a savoir l'atteinte du facteu   ;environnement
2UBJ38IF6K;ce marche a pour objet la realisation de l'evaluation strategique environnementale ese du contrat de plan regional etat region cper de la region provence alpes cote d'azurpaca et du contrat de plan interregional convention interregionale d   ;environnement
JG5XF1JVKL;evaluation environnementale du plan departemental de prevention et de gestion des dechets non dangereux de la loire;environnement
9EDS8SDKJB;evaluation strategique environnementale du contrat de plan etat region 2014 2020;environnement
ZZ5HFZLBQ6;evaluation strategique environnementale du contrat de plan etat region picardie;environnement
8AL30QBE9X;evaluation de la politique regionale  evaluation strategique environnementale du contrat de plan etat region 2015 2020 ;environnement
N0PGJDVWM9;realisation d'une evaluation retrospective d'une grappe de projets finances sur le fonds d'etude et d'aide au secteur prive fasep pour des etudes et preparation de projets en montage partenariat public prive ppp ;social
65PIKJQOM2;marche de prestation d'evaluation finale du contrat local de sante cls du pays de vitre   porte de bretagne;santé
KB5GTZWAX7;etude sur l'evaluation de la politique departementale relative a la preservation de la biodiversite a evreux;environnement
O7VKCUFDDV;evaluation environnementale cper et cpier 2014 2020;environnement
11J2YHEV7M;mise en place d'une demarche de construction partagee d'un referentiel d'evaluation du projet promeneurs du net;urbanité-transports
WBTJE8YJZD;belgique bruxelles: evaluation ex post des programmes de la politique de cohesion 2007 2013 finances par le fonds europeen de developpement regional feder et le fonds de cohesion fc ? volet 3: instruments financiers pour l'aide aux entreprises;fiscalité-économie
BD6QCU0ZSH;belgique bruxelles: evaluation ex post des programmes de la politique de cohesion 2007 2013 finances par le fonds europeen de developpement regional feder et le fonds de cohesion fc ? volet 9: culture et tourisme;social
QVH3ZJP0VI;evaluation strategique environnementale;environnement
9HLZFQMZ3G;l'evaluation etablira la nature des investissements cofinances dans le secteur du tourisme et de la culture  et determinera les raisons de leur contribution reelle et potentielle a la croissance et a la creation d'emplois ;emploi-insertion
F3RSNJAU8X;le present marche evaluera la logique  la mise en oeuvre et les premiers indices de l'efficacite des fonds propres de capital risque  des prets et des garanties collectivement appeles <<instruments d'ingenierie financiere>> fei  <<instruments fi   ;fiscalité-économie
1I8VZJVUPS;evaluation des dispositifs logement des jeunes  de la region aquitaine : dispositif  un  deux  toit  dispositif cle aquitaine aide octroyee en subvention pour la captation d'une offre de logement temporaire dans le parc diffus;logement
GBH9YG6BN6;evaluation du plan pour la reussite a l'ecole et une meilleure insertion scolare premis;éducation-recherche
GBCLQUOPTT;l'evaluation portera sur la logique  la mise en oeuvre et la preuve de l'efficacite du soutien de la politique de cohesion aux grandes entreprises ;fiscalité-économie
76UH92LZMJ;evaluation environnementale dans le cadre de la revision du plan de deplacements urbains de la communaute d'agglomeration du pays ajaccien ;urbanité-transports
